{
  "slug": "ai-automation-blog-post",
  "title": "Unlocking the Power of AI Automation",
  "description": "Discover how artificial intelligence is transforming businesses through automation, insights, and efficiency.",
  "excerpt": "In this blog post, we'll explore the benefits and applications of AI automation, from process optimization to predictive analytics. Read on to learn more about the exciting future of work.",
  "publishedAt": "2023-02-14T12:00:00Z",
  "tags": [
    "AI",
    "Automation",
    "Business"
  ],
  "sections": [
    {
      "heading": "What is AI Automation?",
      "body": "AI automation refers to the use of artificial intelligence (AI) and machine learning (ML) to automate repetitive, mundane, or complex tasks. By leveraging algorithms and data analysis, AI-powered tools can streamline processes, improve accuracy, and free up human resources for higher-value tasks."
    },
    {
      "heading": "Benefits of AI Automation",
      "body": "The benefits of AI automation are numerous. Some key advantages include increased productivity, reduced costs, improved accuracy, and enhanced decision-making capabilities. By automating tasks, businesses can also reduce the risk of errors, minimize downtime, and improve overall operational efficiency."
    },
    {
      "heading": "Applications of AI Automation",
      "body": "AI automation is being applied across various industries, including customer service, finance, healthcare, marketing, and supply chain management. Some specific use cases include chatbots for customer support, predictive maintenance in manufacturing, and personalized product recommendations in e-commerce."
    },
    {
      "heading": "Future of Work: AI Automation and Human Collaboration",
      "body": "As AI automation continues to evolve, it's crucial to consider the future of work and human collaboration. While AI will undoubtedly augment our abilities, it's also essential to maintain human touch and oversight to ensure the responsible deployment of these technologies."
    }
  ],
  "status": "draft",
  "workflow": {
    "generatedBy": "ollama",
    "model": "llama3:latest",
    "reviewState": "pending"
  },
  "updatedAt": "2026-04-16T11:48:56.573Z"
}
