{
  "slug": "ai-automation-benefits",
  "title": "Unlocking the Power of AI Automation",
  "description": "Discover how artificial intelligence is transforming industries and revolutionizing business processes.",
  "excerpt": "In this article, we'll explore the top benefits of AI automation and how it can streamline your operations.",
  "publishedAt": "2022-09-15T14:30:00Z",
  "tags": [
    "AI",
    "automation",
    "business"
  ],
  "sections": [
    {
      "heading": "What is AI Automation?",
      "body": "AI automation is the use of artificial intelligence and machine learning algorithms to automate repetitive and mundane tasks, freeing up human resources for more strategic and creative work."
    },
    {
      "heading": "Benefits of AI Automation",
      "body": "AI automation offers numerous benefits, including increased efficiency, reduced costs, improved accuracy, and enhanced customer experience."
    },
    {
      "heading": "Real-World Applications",
      "body": "From data entry to customer service chatbots, AI automation is being used in various industries to improve processes and drive business results."
    },
    {
      "heading": "Getting Started with AI Automation",
      "body": "In this section, we'll provide a step-by-step guide on how to get started with AI automation and implement it into your organization."
    }
  ],
  "status": "draft",
  "workflow": {
    "generatedBy": "ollama",
    "model": "llama3:latest",
    "reviewState": "pending"
  },
  "updatedAt": "2026-04-16T11:53:13.226Z"
}
